<?xml version="1.0" encoding="UTF-8"?>
<chemistry_data xmlns:xs="http://www.w3.org/2001/XMLSchema-instance" xs:noNamespaceSchemaLocation="chemistry.xsd">
  <!--The number of possible phases in the microstructure not counting Void-->
  <numentries>18</numentries>
  <!--Temperature in K-->
  <temperature>298.15</temperature>
  <!--Do not change next value, used for Parrott and Killoh kinetic model-->
  <reftemperature>298.15</reftemperature>
  <!--Set to 1 for saturated, 0 for sealed-->
  <saturated>1</saturated>
  <!--Void phase should always be present and first in the list-->
  <phase>
    <thamesname>Void</thamesname>
    <!--Unique integer id for microstructure phase-->
    <id>0</id>
    <!--This microstructure phase is not a cement component (value = 0; if yes, value = 1)-->
    <cement_component>0</cement_component>
    <!--Display rgb colors, 0 to 255 (set by default => optional)-->
    <display_data>
      <red>0.0</red>
      <green>0.0</green>
      <blue>0.0</blue>
      <gray>0.0</gray>
    </display_data>
  </phase>
  <phase>
    <thamesname>Alite</thamesname>
    <id>2</id>
    <cement_component>1</cement_component>
    <interface_data></interface_data>
    <gemphase_data>
      <gemphasename>Alite</gemphasename>
      <gemdc>
        <gemdcname>C3S</gemdcname>
      </gemdc>
    </gemphase_data>
    <impurity_data>
      <k2ocoeff>0.00087</k2ocoeff>
      <na2ocoeff>0.0</na2ocoeff>
      <mgocoeff>0.00861</mgocoeff>
      <so3coeff>0.007942</so3coeff>
    </impurity_data>
    <kinetic_data>
      <type>ParrotKilloh</type>
      <specificSurfaceArea>402.0</specificSurfaceArea>
      <refSpecificSurfaceArea>385.0</refSpecificSurfaceArea>
      <k1>1.5</k1>
      <k2>0.05</k2>
      <k3>1.1</k3>
      <n1>0.7</n1>
      <n3>3.3</n3>
      <dorHcoeff>2.0</dorHcoeff>
      <!--Apparent activation energy for dissolution - another P&K parameter-->
      <activationEnergy>41570.0</activationEnergy>
      <loi>0.0</loi>
    </kinetic_data>
  </phase>
  <phase>
    <thamesname>CSHQ</thamesname>
    <id>11</id>
    <cement_component>0</cement_component>
    <interface_data>
      <affinity>
        <affinityphase>Alite</affinityphase>
        <contactanglevalue>30</contactanglevalue>
      </affinity>
      <affinity>
        <affinityphase>Belite</affinityphase>
        <contactanglevalue>30</contactanglevalue>
      </affinity>
    </interface_data>
    <gemphase_data>
      <gemphasename>CSHQ</gemphasename>
      <gemdc>
        <gemdcname>CSHQ-JenD</gemdcname>
        <gemdcporosity>0.4935</gemdcporosity>
      </gemdc>
      <gemdc>
        <gemdcname>CSHQ-JenH</gemdcname>
        <gemdcporosity>0.4935</gemdcporosity>
      </gemdc>
      <gemdc>
        <gemdcname>CSHQ-TobD</gemdcname>
        <gemdcporosity>0.2004</gemdcporosity>
      </gemdc>
      <gemdc>
        <gemdcname>CSHQ-TobH</gemdcname>
        <gemdcporosity>0.2004</gemdcporosity>
      </gemdc>
      <gemdc>
        <gemdcname>KSiOH</gemdcname>
        <gemdcporosity>0.1825</gemdcporosity>
      </gemdc>
      <gemdc>
        <gemdcname>NaSiOH</gemdcname>
        <gemdcporosity>0.1825</gemdcporosity>
      </gemdc>
    </gemphase_data>
    <poresizefilename>CSH-PoreSizeDistribution.csv</poresizefilename>
    <Rd>
      <Rdelement>K</Rdelement>
      <Rdvalue>0.41999999</Rdvalue>
    </Rd>
    <Rd>
      <Rdelement>Na</Rdelement>
      <Rdvalue>0.41999999</Rdvalue>
    </Rd>
  </phase>
</chemistry_data>
